{
  "claim_boundary": "Snapshot immutability attestation only; not a model score or comparison.",
  "created_at_utc": "2026-08-11T20:16:42.208146Z",
  "execution_checkout": {
    "head_sha": "242a39348291141d635a752b9e078fabdab011ea",
    "status_entry_count": 0,
    "tree_sha": "a017ff68b86a952f1c4b10e21699942f66eab427"
  },
  "files": [
    {
      "bytes": 11343,
      "path": "LICENSE",
      "role": "model",
      "sha256": "832dd9e00a68dd83b3c3fb9f5588dad7dcf337a0db50f7d9483f310cd292e92e"
    },
    {
      "bytes": 660,
      "path": "config.json",
      "role": "model",
      "sha256": "98d2ff8cc47488d08a2b0b3acf4eb99ef210779b42bd48605f6b8e36acdbf670"
    },
    {
      "bytes": 242,
      "path": "generation_config.json",
      "role": "model",
      "sha256": "e558847a8b4402616f1273797b015104dc266fe4b520056fca88823ba8f8ebe6"
    },
    {
      "bytes": 3087467144,
      "path": "model.safetensors",
      "role": "model",
      "sha256": "dd924a11b4c220f385b51ffa522daea7c9f3d850e31b162bb5661df483c6d3ee"
    },
    {
      "bytes": 1671839,
      "path": "merges.txt",
      "role": "tokenizer",
      "sha256": "599bab54075088774b1733fde865d5bd747cbcc7a547c5bc12610e874e26f5e3"
    },
    {
      "bytes": 7031645,
      "path": "tokenizer.json",
      "role": "tokenizer",
      "sha256": "c0382117ea329cdf097041132f6d735924b697924d6f6fc3945713e96ce87539"
    },
    {
      "bytes": 7305,
      "path": "tokenizer_config.json",
      "role": "tokenizer",
      "sha256": "5b5d4f65d0acd3b2d56a35b56d374a36cbc1c8fa5cf3b3febbbfabf22f359583"
    },
    {
      "bytes": 2776833,
      "path": "vocab.json",
      "role": "tokenizer",
      "sha256": "ca10d7e9fb3ed18575dd1e277a2579c16d108e32f27439684afa0e10b1440910"
    }
  ],
  "packet_parent_sha": "0ab47a182537dc3842d7ea4ea24e45b92cc5dc8f",
  "phase": "POST_INFERENCE",
  "result_receipt_sha256": "97b9a315b891731595d323092c235b2fc141ba1e897afeedb90e723f2eeaffee",
  "schema_version": "paper2-model-snapshot-attestation-v4",
  "snapshot_canonical_sha256": "4ea189b68b5726f771a3f1b659aa0c680bf8b03521380ea9076cf81413d1f89c",
  "snapshot_path": "/projects/hep/fs9/users/scyiu/RAKL-paper2/assets/paper2-model-qwen25-1_5b-v4-3/model/Qwen--Qwen2.5-1.5B-Instruct/989aa7980e4cf806f80c7fef2b1adb7bc71aa306"
}
